{
  "$schema": "https://json-schema.org/draft/2020-12/schema",
  "$id": "https://openvibe.network/contracts/run/job-create-request.v1.json",
  "title": "RunJobCreateRequest",
  "description": "run.job-create-request@1 (PLANNED; plan T14 R1, ADR-034): the body of POST /api/v1/jobs on OpenVibe.Run (capability run.job.submit). The job belongs to the project the caller's token names, or, for a first-party service acting for a person (X-OV-Subject), the project it names with X-OV-Project once Network confirms the person is an admin or owner of it (ADR-003 amendment 2026-10-12); the person is then the requester and the service is recorded as via. CLASS is a platform.runtime-class@1 name; Run accepts any of them but places a job only on a node that advertises worker:<class> (platform.resource-offer@1), so a class no node runs today (browser, linux, desktop, gpu) ends expired with run.job.unplaceable. ARTIFACT is the pre-registered artifact to run (name and one exact version), required for function and code, as platform.job@1 carries it. ARGS is the artifact's declared input as JSON (at most 512 KiB serialized, else 413). INPUTS are files placed in the job directory before the process starts, each an OpenVibe.Media object pinned by its sha256: a size or digest mismatch fails the job (run.job.input_digest_mismatch) before the process ever runs; Run never fetches a caller-chosen URL. LIMITS are hard caps merged stricter with the node's own (platform.job@1 limits); a request over the project's tier cap is refused 422 run.limits.exceeded, never silently lowered. EGRESS is the network the job may reach, the values of OpenVibe.Node's worker.egress, carried per job as the same-named platform.job@1 net: none (default; no network), public or openvibe-only. A job asking for public or openvibe-only is placed only on a node whose worker.egress allows it; a worker whose host policy is stricter runs the stricter one. REQUIREMENTS (platform.workload-requirements@1) narrow placement; absent means { kind: run.<class>, mobility: job, latency_class: background, objective: balanced }. IDEMPOTENCY_KEY: a repeat from the same project within 24 h with an identical body answers the first job (200, created false); with a different body 409 run.idempotency.conflict. NODE pins the machine: the device id (dev_…) of the job's own machine in Run's placement (platform.resource-offer@1 node_id, as GET /api/v1/machines on OpenVibe.Bot names it), answered by 409 run.job.node_offline when that machine is not connected, never moved to another one (Codes C9c).",
  "type": "object",
  "additionalProperties": false,
  "required": [
    "class",
    "limits"
  ],
  "properties": {
    "class": {
      "$ref": "../platform/runtime-class.v1.json"
    },
    "artifact": {
      "$ref": "#/$defs/artifact"
    },
    "args": {
      "type": "object",
      "description": "The artifact's declared input as JSON; default {}."
    },
    "inputs": {
      "type": "array",
      "maxItems": 32,
      "items": {
        "$ref": "#/$defs/input"
      },
      "description": "Files placed in the job directory before the process starts; names are unique (else 422)."
    },
    "limits": {
      "$ref": "#/$defs/limits"
    },
    "ttl_ms": {
      "type": "integer",
      "minimum": 1000,
      "maximum": 86400000,
      "description": "Lifetime from creation, covering the wait for a node and the run (platform.job@1 ttl_ms); when it runs out the job ends expired. Default: limits.wall_ms plus 600000."
    },
    "egress": {
      "$ref": "#/$defs/egress"
    },
    "requirements": {
      "$ref": "../platform/workload-requirements.v1.json"
    },
    "idempotency_key": {
      "$ref": "#/$defs/idempotency_key"
    },
    "node": {
      "type": "string",
      "pattern": "^dev_[0-9A-HJKMNP-TV-Z]{26}$",
      "description": "The machine to run on, pinned: the device id (dev_…) of the job's own machine in Run's placement, as platform.resource-offer@1 node_id and OpenVibe.Bot's GET /api/v1/machines name it (Codes C9c). Run places the job only on that machine and refuses it 409 run.job.node_offline when it is not connected, never moving it to another one. Absent: Run places it on any machine that fits."
    }
  },
  "allOf": [
    {
      "if": {
        "required": ["class"],
        "properties": { "class": { "enum": ["function", "code"] } }
      },
      "then": {
        "required": ["artifact"]
      }
    }
  ],
  "$defs": {
    "artifact": {
      "type": "object",
      "additionalProperties": false,
      "description": "The pre-registered artifact to run (platform.job@1 artifact).",
      "required": ["name", "version"],
      "properties": {
        "name": { "type": "string", "pattern": "^[a-z0-9][a-z0-9._-]{0,127}$" },
        "version": { "type": "string", "pattern": "^[0-9A-Za-z][0-9A-Za-z.+-]{0,63}$", "description": "One exact version, never a range" }
      }
    },
    "input": {
      "type": "object",
      "additionalProperties": false,
      "description": "One input file: an OpenVibe.Media object the caller's project can read, pinned by digest.",
      "required": ["name", "media_id", "sha256"],
      "properties": {
        "name": { "type": "string", "pattern": "^[A-Za-z0-9][A-Za-z0-9._-]{0,127}$", "description": "File name in the job directory; no path separators." },
        "media_id": { "type": "string", "pattern": "^med_[0-9A-HJKMNP-TV-Z]{26}$" },
        "sha256": { "type": "string", "pattern": "^[0-9a-f]{64}$", "description": "Lowercase hex SHA-256 of the object's bytes." },
        "size_bytes": { "type": "integer", "minimum": 0 }
      }
    },
    "limits": {
      "type": "object",
      "additionalProperties": false,
      "description": "Caps on the running process (platform.job@1 limits); hitting one ends the job failed with run.job.limit.",
      "required": ["wall_ms", "cpu_ms", "mem_bytes"],
      "properties": {
        "wall_ms": { "type": "integer", "minimum": 1, "description": "Running time from `job_started`" },
        "cpu_ms": { "type": "integer", "minimum": 1, "description": "CPU time, user plus system" },
        "mem_bytes": { "type": "integer", "minimum": 1, "description": "Peak resident memory" }
      }
    },
    "egress": {
      "type": "string",
      "enum": ["none", "public", "openvibe-only"],
      "default": "none",
      "description": "OpenVibe.Node worker.egress values: none (no network), public (the internet without private, link-local or the network's own ranges), openvibe-only (the network's own endpoints only)."
    },
    "idempotency_key": {
      "type": "string",
      "pattern": "^[A-Za-z0-9._:-]{1,128}$"
    }
  },
  "examples": [
    {
      "class": "function",
      "artifact": { "name": "thumbnail", "version": "1.2.0" },
      "args": { "width": 320 },
      "inputs": [
        { "name": "photo.jpg", "media_id": "med_01JAB2C3D4E5F6G7H8J9K0MNPQ", "sha256": "9f86d081884c7d659a2feaa0c55ad015a3bf4f1b2b0b822cd15d6c15b0f00a08", "size_bytes": 482113 }
      ],
      "limits": { "wall_ms": 30000, "cpu_ms": 30000, "mem_bytes": 268435456 },
      "egress": "none",
      "idempotency_key": "thumb:photo-7"
    }
  ]
}
