{
  "class": "function",
  "artifact": {
    "name": "thumbnail",
    "version": "1.2.0"
  },
  "args": {
    "width": 320
  },
  "inputs": [
    {
      "name": "photo.jpg",
      "media_id": "med_01JAB2C3D4E5F6G7H8J9K0MNPS",
      "sha256": "9f86d081884c7d659a2feaa0c55ad015a3bf4f1b2b0b822cd15d6c15b0f00a08",
      "size_bytes": 482113
    }
  ],
  "limits": {
    "wall_ms": 30000,
    "cpu_ms": 30000,
    "mem_bytes": 268435456
  },
  "ttl_ms": 630000,
  "egress": "none",
  "idempotency_key": "thumb:photo-7"
}
